{
  "schema": "scan-generation-scenario-v1",
  "scenario_id": "scope-change-abandons-old-generation",
  "root": "/watched",
  "entry_cap": 2,
  "generations": [
    {
      "generation_id": "G1",
      "scope_version": "scope-1",
      "state": "abandoned",
      "abandonment_reason": "scope-version-changed",
      "slices": [
        {"slice_index": 0, "cursor_before": null, "cursor_after": "frontier-2", "staged_objects": 2, "restart_boundary": false, "has_more": true, "authoritative_reconciliation": false}
      ]
    },
    {
      "generation_id": "G2",
      "scope_version": "scope-2",
      "state": "complete",
      "abandonment_reason": null,
      "slices": [
        {"slice_index": 0, "cursor_before": null, "cursor_after": "frontier-2", "staged_objects": 2, "restart_boundary": false, "has_more": true, "authoritative_reconciliation": false},
        {"slice_index": 1, "cursor_before": "frontier-2", "cursor_after": null, "staged_objects": 3, "restart_boundary": false, "has_more": false, "authoritative_reconciliation": true}
      ]
    }
  ],
  "expectations": {
    "completed_generation_id": "G2",
    "current_state_source": "G2",
    "change_history_source": "G2",
    "entry_cap_gap": "resolved",
    "absence_action": "reconcile-after-completion"
  }
}
